{
  "schema_version": "1.0",
  "packet_id": "M4-COMBINED-VALIDATION-TEST-PACKET-001",
  "status": "USER_APPROVED_LOCAL_IMPLEMENTATION_AUTHORIZED",
  "authority": {
    "user_approval_date": "2026-08-25",
    "formal_execution_authorized": false,
    "p9_1_user_approval_date": "2026-08-25",
    "p9_1_design": "SEQUENTIAL_VAD_ASR_LLM_TTS_RESIDENCY",
    "m3_gate2a_ack_commit": "5aac035d25f6498c3c0affe1ace4afd7de8f7254",
    "p9_core_ack_commit": "caf4f7ba867e4ebc1972df0ade86c605a873a286"
  },
  "source": {
    "audio_m3_execution_baseline_sha": "f7b9694d1477f26513880526e0718d2b3c5766b3",
    "audio_m4_execution_sha": null,
    "core_hal_execution_sha": "6c7fc8ce94c7218e4948b77c2fe79ef6e6cc3dcf"
  },
  "fixtures": {
    "recording_plan_sha256": "d197078d78ad422e1ec6465aea36472adcc4e77c24827c426a03dcbc4b4ba920",
    "tts_prompt_sha256": "1f9699344394e718fa0d30fb24df3219407680268340418e564c70cc13007739",
    "controlled_fixture_lock_required": true,
    "catalog_correction": "M4-P9.1-CATALOG-CORRECTION-001",
    "sessions": [
      ["M4-SESSION-01", "taiwan_mandarin", "asr-clear-002", "tts-001"],
      ["M4-SESSION-02", "taiwan_mandarin", "asr-clear-003", "tts-002"],
      ["M4-SESSION-03", "taiwan_mandarin", "asr-pause-026", "tts-003"],
      ["M4-SESSION-04", "taiwan_mandarin", "asr-pause-031", "tts-004"],
      ["M4-SESSION-05", "code_switch", "asr-clear-011", "tts-005"],
      ["M4-SESSION-06", "code_switch", "asr-clear-012", "tts-006"],
      ["M4-SESSION-07", "code_switch", "asr-pause-036", "tts-007"],
      ["M4-SESSION-08", "code_switch", "asr-pause-038", "tts-008"],
      ["M4-SESSION-09", "number", "asr-clear-016", "tts-009"],
      ["M4-SESSION-10", "number", "asr-clear-017", "tts-010"],
      ["M4-SESSION-11", "number", "asr-pause-041", "tts-011"],
      ["M4-SESSION-12", "number", "asr-pause-043", "tts-012"],
      ["M4-SESSION-13", "date", "asr-clear-020", "tts-013"],
      ["M4-SESSION-14", "date", "asr-clear-021", "tts-014"],
      ["M4-SESSION-15", "date", "asr-pause-045", "tts-015"],
      ["M4-SESSION-16", "date", "asr-pause-046", "tts-016"],
      ["M4-SESSION-17", "product_term", "asr-clear-023", "tts-017"],
      ["M4-SESSION-18", "product_term", "asr-clear-024", "tts-018"],
      ["M4-SESSION-19", "product_term", "asr-pause-048", "tts-019"],
      ["M4-SESSION-20", "product_term", "asr-pause-049", "tts-020"]
    ]
  },
  "pipeline": {
    "order": ["vad", "asr", "reasoner", "tts", "audio_output_completion"],
    "pcm": "16000_HZ_MONO_S16_LE",
    "frame_samples": 320,
    "frame_bytes": 640,
    "frame_duration_ms": 20,
    "reasoner": "DETERMINISTIC_SESSION_ID_TO_FROZEN_TTS_ID_NO_TRANSCRIPT_MUTATION",
    "network_disabled": true,
    "persistent_domains": ["vad", "asr", "tts"]
  },
  "candidates": {
    "vad": {
      "id": "vad-silero-onnx-6.2.1",
      "model_sha256": "1a153a22f4509e292a94e67d6f9b85e8deb25b4988682b7e174c65279d8788e3"
    },
    "asr": {
      "id": "asr-whispercpp-base-q8_0-1.9.2-m2b",
      "model_sha256": "c577b9a86e7e048a0b7eada054f4dd79a56bbfa911fbdacf900ac5b567cbb7d9",
      "threads": 4,
      "language": "zh",
      "decoder": "greedy_best_of_1",
      "initial_prompt_sha256": "e3b2606c90009ce609aa23183c2229619619cf1173dc17d2ecd2308bfe4fe8ef"
    },
    "tts": {
      "id": "tts-sherpa-matcha-zh-en-1.13.5",
      "archive_sha256": "271b804af570400d3bcdcb53bf6e53cc9f75180ee763b9f13eb5eaf2b0d086ef",
      "vocoder_sha256": "b599142a1fb8ff03de3e84ac35ff537c619e56f4267a6fe894851a42844acf9e"
    }
  },
  "p9": {
    "test_id": "M4-P9.1-REALISTIC-TURN-RESIDENCY-001",
    "supersedes_test_id": "M4-P9-RESIDENCY-001",
    "orchestration_policy": "VAD_ASR_THEN_P9_INFER_THEN_REASONER_TTS",
    "controller_thread_policy": {"OPENBLAS_NUM_THREADS": "1"},
    "artifact_id": "M4B-P9-RESIDENCY-SURROGATE-001",
    "source_sha": "f18f823146727b50cb3ef15e9e14b51983643406",
    "protocol_version": "1.0",
    "sha256": {
      "runner": "311466f963bce806b2c89a1c4f5b3275134312e307386c35631eabfb3d21be76",
      "schema": "d5de8fe4144a6c759445f7e45e8867a6bad928177cb28f96d908bbcd59ddb8fe",
      "lock": "d8310132072e822a316521e3bd1cd21e7f0c8396dd49d82c1c6a64a247b7f7f0"
    },
    "profile": {
      "reserve_mib": 2304,
      "cpu_workers": 4,
      "startup_delay_s": 6.0,
      "inference_duration_s": 6.0,
      "ready_timeout_s": 10.0,
      "shutdown_timeout_s": 5.0
    },
    "capacity_gate_mib": 3584,
    "catalog": [
      "M4-SESSION-01", "M4-SESSION-02", "M4-SESSION-03", "M4-SESSION-04",
      "M4-SESSION-05", "M4-SESSION-06", "M4-SESSION-07", "M4-SESSION-08",
      "M4-SESSION-09", "M4-SESSION-10", "M4-SESSION-11", "M4-SESSION-12",
      "M4-SESSION-13", "M4-SESSION-14", "M4-SESSION-15", "M4-SESSION-16",
      "M4-SESSION-17", "M4-SESSION-18", "M4-SESSION-19", "M4-SESSION-20"
    ],
    "execution_status": "Pending"
  },
  "failure_injections": [
    ["M4-FI-VAD-ERROR", "vad", "error"],
    ["M4-FI-VAD-TIMEOUT", "vad", "timeout"],
    ["M4-FI-VAD-CANCEL", "vad", "cancel"],
    ["M4-FI-VAD-FORCE-ABORT", "vad", "force_abort"],
    ["M4-FI-ASR-ERROR", "asr", "error"],
    ["M4-FI-ASR-TIMEOUT", "asr", "timeout"],
    ["M4-FI-ASR-CANCEL", "asr", "cancel"],
    ["M4-FI-ASR-FORCE-ABORT", "asr", "force_abort"],
    ["M4-FI-TTS-ERROR", "tts", "error"],
    ["M4-FI-TTS-TIMEOUT", "tts", "timeout"],
    ["M4-FI-TTS-CANCEL", "tts", "cancel"],
    ["M4-FI-TTS-FORCE-ABORT", "tts", "force_abort"]
  ],
  "timeouts_seconds": {
    "ready": 10,
    "operation": 120,
    "failure_terminal": 10,
    "p9_ready": 10,
    "p9_shutdown": 5,
    "combined_phase": 3600,
    "failure_phase": 1800
  },
  "publication_status": "DRAFT_USER_CONFIRMATION_PENDING"
}
